{"$schema": "./schema.json", "instanceId": "flame-wrap.defaults", "theme": {}, "global": {"speed": 1, "delayOffset": 0, "easing": "ease-out-cubic"}, "elements": [], "extras": {"color": "#FF5722", "intensity": 0.5, "height": 170, "spread": 8, "radius": 40, "speed": 0.25, "scale": 0.75, "turbulence": 0.5, "turbulenceScale": 0.5, "turbulenceReach": 25, "sparks": 1.5, "sparkSize": 0.35, "sparkDensity": 1, "sparkSpeed": 1, "rim": 2.5, "melt": 4.5, "distortion": 10, "smoke": 1.5, "ember": 2, "scorch": 0, "fadeInFrames": 0, "fadeOutFrames": 0}}
